{
  "$schema": "https://json-schema.org/draft/2020-12/schema",
  "title": "Runtime Smoke",
  "type": "object",
  "additionalProperties": false,
  "required": [
    "runtime",
    "version",
    "python_executable",
    "writable_temp_dir_status",
    "git_freshness_result",
    "exact_command",
    "command_exit_status",
    "smoke_result",
    "sandbox_write_mode",
    "brain_command_mode",
    "blocked_commands",
    "run_scope",
    "evidence"
  ],
  "properties": {
    "runtime": {
      "type": "string",
      "minLength": 1
    },
    "version": {
      "type": "string",
      "minLength": 1
    },
    "python_executable": {
      "type": "string",
      "minLength": 1
    },
    "writable_temp_dir_status": {
      "enum": [
        "writable",
        "blocked",
        "not_checked"
      ]
    },
    "git_freshness_result": {
      "type": "string",
      "minLength": 1
    },
    "exact_command": {
      "type": "string",
      "minLength": 1
    },
    "command_exit_status": {
      "type": "integer",
      "minimum": 0
    },
    "smoke_result": {
      "enum": [
        "pass",
        "blocked",
        "fail"
      ]
    },
    "sandbox_write_mode": {
      "enum": [
        "read_only",
        "workspace_write",
        "approval_gated",
        "unrestricted",
        "unknown"
      ]
    },
    "brain_command_mode": {
      "enum": [
        "native_commands",
        "markdown_specs",
        "mixed",
        "unknown"
      ]
    },
    "blocked_commands": {
      "type": "array",
      "items": {
        "type": "string",
        "minLength": 1
      }
    },
    "run_scope": {
      "enum": [
        "read_only_smoke",
        "full_validation"
      ]
    },
    "evidence": {
      "type": "array",
      "minItems": 1,
      "items": {
        "type": "string",
        "minLength": 1
      }
    }
  }
}
